{
  "schema_version": "0.1.0",
  "dataset_kind": "qualitative_findings_not_reference_measurements",
  "source_registry": "source-catalogue.csv",
  "findings": [
    {
      "finding_id": "F001",
      "source_id": "V02",
      "source_url": "https://www.youtube.com/watch?v=9VjjfIzDhos",
      "review_date": "2026-10-08",
      "topic": "leg_flexion_changes_across_linked_turns",
      "context": [
        "parallel_turn_demonstration",
        "following_camera"
      ],
      "source_segment": {
        "start_s": 133,
        "end_s": 141,
        "locator_precision": "approximate_player_location",
        "source_capture_speed_verified": false
      },
      "evidence_basis": [
        "playback_frames"
      ],
      "visual_observation": "More upright configurations alternate with inclined positions; relative leg flexion changes as the skier changes turn side.",
      "coaching_guidance": null,
      "research_interpretation": "Retain both leg trajectories and their timing rather than a single peak knee angle.",
      "movement_sequence": [
        {
          "earlier": "more_upright_configuration",
          "relation": "alternates_with",
          "later": "inclined_turn_configuration",
          "basis": "visually_observed"
        }
      ],
      "sensor_connection": {
        "status": "candidate_proxy",
        "single_boot": "Investigate boot angular-rate reversals; these do not measure knee flexion.",
        "dual_boot": "Investigate bilateral timing without treating it as leg joint angles.",
        "pressure_insoles": "Could independently investigate loading; posture does not establish load.",
        "validation_needed": [
          "Synchronised body observations and boot recordings",
          "Independent event definitions"
        ]
      },
      "quality": {
        "review_scope": "selected_playback",
        "camera_view": "rear_oblique_following",
        "confidence_probability": null,
        "limitations": [
          "Perspective and camera motion",
          "Source capture speed unverified",
          "No force inference"
        ],
        "validated_for_openski": false,
        "spoken_audio_reviewed": false
      },
      "numerical_measurements": []
    },
    {
      "finding_id": "F002",
      "source_id": "V01",
      "source_url": "https://www.youtube.com/watch?v=RGgF-hQrZqc",
      "review_date": "2026-10-08",
      "topic": "analysis_playback_is_not_physical_turn_time",
      "context": [
        "coaching_analysis",
        "held_images"
      ],
      "source_segment": {
        "start_s": 395,
        "end_s": 403,
        "locator_precision": "approximate_player_location",
        "source_capture_speed_verified": false
      },
      "evidence_basis": [
        "playback_frames",
        "visible_written_annotation"
      ],
      "visual_observation": "The displayed skiing configuration is held while the analysis progresses.",
      "coaching_guidance": "A visible annotation encourages patience in transition.",
      "research_interpretation": "Separate lesson timestamps from movement duration; this excerpt supports conceptual review, not a duration reference.",
      "movement_sequence": [],
      "sensor_connection": {
        "status": "methodological_constraint",
        "single_boot": "Do not fit event-duration targets to paused lesson playback.",
        "dual_boot": "The same timebase restriction applies to bilateral comparisons.",
        "pressure_insoles": "Do not align loading events to held visual frames as if they were real time.",
        "validation_needed": [
          "Verified original capture timebase",
          "Uninterrupted event reference"
        ]
      },
      "quality": {
        "review_scope": "selected_playback",
        "camera_view": "rear_analysis_overlay",
        "confidence_probability": null,
        "limitations": [
          "Held frames",
          "No usable transcript",
          "No physical duration claim"
        ],
        "validated_for_openski": false,
        "spoken_audio_reviewed": false
      },
      "numerical_measurements": []
    },
    {
      "finding_id": "F003",
      "source_id": "V03",
      "source_url": "https://www.youtube.com/watch?v=QIyQ9F2aj4k",
      "review_date": "2026-10-08",
      "topic": "task_specific_peak_edging_phase",
      "context": [
        "dynamic_short_turns",
        "certification_task_variations"
      ],
      "source_segment": {
        "start_s": null,
        "end_s": null,
        "locator_precision": "description_only",
        "source_capture_speed_verified": false
      },
      "evidence_basis": [
        "creator_description"
      ],
      "visual_observation": null,
      "coaching_guidance": "The creator describes progressive edging and deliberate variations in the phase of maximum edging.",
      "research_interpretation": "Task identity must accompany any proposed peak-timing reference.",
      "movement_sequence": [
        {
          "earlier": "edge_angle_development",
          "relation": "before",
          "later": "edge_angle_release",
          "basis": "coaching_guidance"
        }
      ],
      "sensor_connection": {
        "status": "candidate_proxy",
        "single_boot": "Research boot-rate or conditional orientation timing within a declared task.",
        "dual_boot": "Compare both boots within matching tasks; no universal phase target.",
        "pressure_insoles": "Load maxima are separate events from edging maxima.",
        "validation_needed": [
          "Independent ski-angle reference if claiming edging",
          "Task-specific outcomes"
        ]
      },
      "quality": {
        "review_scope": "description_only",
        "camera_view": "not_applicable_to_description",
        "confidence_probability": null,
        "limitations": [
          "Guidance rather than measured event timing",
          "No universal optimal phase inferred"
        ],
        "validated_for_openski": false,
        "spoken_audio_reviewed": false
      },
      "numerical_measurements": []
    },
    {
      "finding_id": "F004",
      "source_id": "V04",
      "source_url": "https://www.youtube.com/watch?v=fX9bgulqRrY",
      "review_date": "2026-10-08",
      "topic": "linked_turn_development_in_railroad_track_drill",
      "context": [
        "advanced_carving_instruction",
        "railroad_track_and_hand_drag_drills"
      ],
      "source_segment": {
        "start_s": 236,
        "end_s": 247,
        "locator_precision": "approximate_player_location",
        "source_capture_speed_verified": false
      },
      "evidence_basis": [
        "playback_frames",
        "sampled_previews",
        "visible_written_annotation"
      ],
      "visual_observation": "The skier links relatively shallow arcs, alternating more upright and inclined configurations.",
      "coaching_guidance": "A preceding visible title identifies the railroad-track drill.",
      "research_interpretation": "Research development and reversal trajectories at modest inclination; spectacular peak lean is not necessary to study the sequence.",
      "movement_sequence": [
        {
          "earlier": "more_upright_configuration",
          "relation": "alternates_with",
          "later": "inclined_arc",
          "basis": "visually_observed"
        }
      ],
      "sensor_connection": {
        "status": "candidate_proxy",
        "single_boot": "Candidate boot-rate development and reversal features.",
        "dual_boot": "Compare bilateral trajectory timing within this drill.",
        "pressure_insoles": "Loading would need independent measurement.",
        "validation_needed": [
          "Synchronised boot/video data",
          "Independent carving or skidding labels"
        ]
      },
      "quality": {
        "review_scope": "selected_playback",
        "camera_view": "mixed_frontal_side_rear",
        "confidence_probability": null,
        "limitations": [
          "Camera pans and the view changes",
          "Not enough detail to certify clean carving",
          "Playback capture delays and jumps preclude duration measurement",
          "No source-speed or biomechanical calibration",
          "Selected excerpts only"
        ],
        "validated_for_openski": false,
        "spoken_audio_reviewed": false
      },
      "numerical_measurements": []
    },
    {
      "finding_id": "F005",
      "source_id": "V04",
      "source_url": "https://www.youtube.com/watch?v=fX9bgulqRrY",
      "review_date": "2026-10-08",
      "topic": "hand_drag_is_a_drill_context",
      "context": [
        "advanced_carving_instruction",
        "railroad_track_and_hand_drag_drills"
      ],
      "source_segment": {
        "start_s": 279,
        "end_s": 325,
        "locator_precision": "approximate_player_location",
        "source_capture_speed_verified": false
      },
      "evidence_basis": [
        "sampled_previews",
        "visible_written_annotation"
      ],
      "visual_observation": "A hand-drag drill is separately titled and illustrated in the previews.",
      "coaching_guidance": null,
      "research_interpretation": "Label drill-specific hand and torso positions separately from free skiing; do not make hand contact a performance target.",
      "movement_sequence": [],
      "sensor_connection": {
        "status": "not_directly_measurable",
        "single_boot": "Boot IMU cannot detect hand contact.",
        "dual_boot": "Two boot IMUs do not measure arms or torso.",
        "pressure_insoles": "Insoles do not identify hand contact.",
        "validation_needed": [
          "Independent movement/task labels",
          "Outcome comparison outside the drill"
        ]
      },